{
  "schema_version": "0.1.0",
  "case_id": "GSE141064-NFKBIA-TNF-RESPONSE",
  "target_claim": {
    "candidate": "basal Nfkbia expression",
    "phenotype": "later LPS-induced Tnf-mCherry increase rate",
    "temporal_order": "basal transcriptomic state measured before the later fluorescent response",
    "biological_system": "Live-seq RAW macrophage cells in GSE141064 Batch 8_8",
    "claim_level": "association",
    "statement": "Basal Nfkbia expression is exploratorily associated with a later LPS-induced Tnf-mCherry response in the observed cells."
  },
  "inherited_constraints": [
    {
      "constraint_id": "C1",
      "statement": "Exact biological independence for the 17 Batch 8_8 cells is not established.",
      "evidence_level": "F4",
      "impact": "blocking"
    },
    {
      "constraint_id": "C2",
      "statement": "Plate labels are technical library-preparation structures and cannot define biological replicates.",
      "evidence_level": "F4",
      "impact": "blocking"
    },
    {
      "constraint_id": "C3",
      "statement": "Per-cell collection day or extraction round was not retained, leaving latent collection-state and day effects unresolved.",
      "evidence_level": "F4",
      "impact": "limiting"
    },
    {
      "constraint_id": "C4",
      "statement": "GSE94383 shows a weak positive association within its matched cell table, but its independent biological unit and ID-prefix semantics are unresolved; cell-level resampling is descriptive only and does not supply independent cross-dataset validation.",
      "evidence_level": "F2",
      "impact": "limiting"
    },
    {
      "constraint_id": "C5",
      "statement": "No identifying intervention or natural experiment isolates a direct Nfkbia effect on the later phenotype.",
      "evidence_level": "F3",
      "impact": "blocking"
    }
  ],
  "scoring_model": {
    "formula_version": "bioevidence.priority.v0.1",
    "formula": "max(0, weighted_positive_sum - uncertainty_penalty_weight * uncertainty_penalty)",
    "weights": {
      "temporal_fit": 2,
      "experimental_unit_fit": 3,
      "cross_dataset_support": 2,
      "confounder_resilience": 3,
      "mechanistic_coherence": 5,
      "intervention_support": 5,
      "falsifiability": 1,
      "effect_relevance": 4
    },
    "uncertainty_penalty_weight": 2
  },
  "hypotheses": [
    {
      "hypothesis_id": "H1_SHARED_UPSTREAM_STATE",
      "rank": 1,
      "priority_score": 49,
      "statement": "A broader pre-existing inflammatory or signaling state drives both basal Nfkbia expression and the later Tnf-mCherry response.",
      "mechanism_class": "shared_upstream_state",
      "status": "supported_explanation",
      "evidence_level": "F3",
      "scores": {
        "temporal_fit": 4,
        "experimental_unit_fit": 1,
        "cross_dataset_support": 1,
        "confounder_resilience": 2,
        "mechanistic_coherence": 4,
        "intervention_support": 0,
        "falsifiability": 4,
        "effect_relevance": 3,
        "uncertainty_penalty": 3
      },
      "score_rationale": [
        "A latent baseline state is temporally compatible with both target measurements.",
        "GSE94383 supplies descriptive pathway context but not independent biological support.",
        "Unresolved collection structure prevents strong separation of biological state from batch or day effects."
      ],
      "evidence_for": [
        "Nfkbia participates in NF-kB feedback biology rather than acting as an isolated feature.",
        "A multivariate cell state can naturally produce both a basal transcript level and a later response phenotype."
      ],
      "evidence_against": [
        "The target dataset is too small and structurally incomplete to resolve the latent state.",
        "No independent baseline-state dataset reproduces the future Tnf-mCherry endpoint."
      ],
      "unresolved_assumptions": [
        "The available expression features adequately represent the load-bearing state.",
        "The association is not mainly generated by collection or imaging differences."
      ],
      "predicted_observations": [
        "A frozen multigene baseline-state model should outperform Nfkbia alone on a temporally compatible dataset with established biological units."
      ],
      "falsifiers": [
        "Nfkbia retains robust incremental value after validated state adjustment across independent biological units."
      ],
      "discriminating_test": {
        "question": "Does a prespecified broader-state model absorb the Nfkbia association?",
        "required_evidence": "Independent pre-stimulation transcriptomes linked to later phenotypes with source-backed biological grouping and frozen nested-model comparison.",
        "operational_protocol_included": false
      }
    },
    {
      "hypothesis_id": "H2_DIRECT_NFKBIA_EFFECT",
      "rank": 2,
      "priority_score": 44,
      "statement": "Basal Nfkbia directly changes the magnitude or dynamics of the later inflammatory response through negative-feedback control.",
      "mechanism_class": "direct_causal_effect",
      "status": "not_identified",
      "evidence_level": "F3",
      "scores": {
        "temporal_fit": 4,
        "experimental_unit_fit": 1,
        "cross_dataset_support": 1,
        "confounder_resilience": 1,
        "mechanistic_coherence": 4,
        "intervention_support": 0,
        "falsifiability": 4,
        "effect_relevance": 3,
        "uncertainty_penalty": 4
      },
      "score_rationale": [
        "The target temporal order and known feedback biology make direct action plausible.",
        "GSE94383 is post-stimulation descriptive context, not an intervention or independent temporal replication.",
        "Experimental units and major confounders remain unresolved."
      ],
      "evidence_for": [
        "Basal Nfkbia precedes the later response in the target observation.",
        "Nfkbia has a coherent role in NF-kB feedback regulation."
      ],
      "evidence_against": [
        "No identifying intervention isolates Nfkbia from broader cellular state.",
        "No accepted independent replication or generalization evidence is available."
      ],
      "unresolved_assumptions": [
        "Basal Nfkbia variation is load-bearing rather than a marker.",
        "The direction and size generalize beyond the observed cells."
      ],
      "predicted_observations": [
        "Nfkbia-specific evidence should shift the later phenotype beyond changes explained by a broader baseline-state model."
      ],
      "falsifiers": [
        "The association disappears after state adjustment in independent biological units.",
        "An adequately sensitive identifying design finds no Nfkbia-specific response difference."
      ],
      "discriminating_test": {
        "question": "Does evidence that isolates Nfkbia from broader state change the later phenotype?",
        "required_evidence": "A temporally matched, independently replicated, institutionally governed identifying design with documented controls.",
        "operational_protocol_included": false
      }
    },
    {
      "hypothesis_id": "H5_STATE_MARKER_ONLY",
      "rank": 3,
      "priority_score": 40,
      "statement": "Nfkbia is a marker of inflammatory readiness but is not itself load-bearing for the later phenotype.",
      "mechanism_class": "state_marker_only",
      "status": "plausible",
      "evidence_level": "F3",
      "scores": {
        "temporal_fit": 4,
        "experimental_unit_fit": 1,
        "cross_dataset_support": 1,
        "confounder_resilience": 2,
        "mechanistic_coherence": 3,
        "intervention_support": 0,
        "falsifiability": 4,
        "effect_relevance": 2,
        "uncertainty_penalty": 3
      },
      "score_rationale": [
        "Nfkbia is compatible with tracking pathway state.",
        "The GSE94383 table provides descriptive response-context coupling but no independent-unit inference.",
        "No evidence shows incremental value beyond correlated state features."
      ],
      "evidence_for": [
        "Nfkbia responds to NF-kB activity and may summarize pathway history."
      ],
      "evidence_against": [
        "The target temporal order remains compatible with a direct effect.",
        "No independent baseline multigene comparison has established redundancy."
      ],
      "unresolved_assumptions": [
        "Other measured features adequately represent the load-bearing state.",
        "Nfkbia has no meaningful incremental causal role."
      ],
      "predicted_observations": [
        "Nfkbia should lose incremental predictive value after conditioning on a validated pathway-state representation."
      ],
      "falsifiers": [
        "Nfkbia retains robust incremental value and identifying evidence supports a specific phenotype change."
      ],
      "discriminating_test": {
        "question": "Is Nfkbia redundant after a frozen broader-state model?",
        "required_evidence": "A temporally compatible dataset with enough independent biological units for nested model comparison and external validation.",
        "operational_protocol_included": false
      }
    },
    {
      "hypothesis_id": "H3_SMALL_CONTEXT_SPECIFIC_EFFECT",
      "rank": 4,
      "priority_score": 37,
      "statement": "The association is biologically real but small, context-specific, and insufficient for broad prediction or intervention claims.",
      "mechanism_class": "small_real_effect",
      "status": "plausible",
      "evidence_level": "F2",
      "scores": {
        "temporal_fit": 3,
        "experimental_unit_fit": 1,
        "cross_dataset_support": 1,
        "confounder_resilience": 2,
        "mechanistic_coherence": 3,
        "intervention_support": 0,
        "falsifiability": 3,
        "effect_relevance": 2,
        "uncertainty_penalty": 3
      },
      "score_rationale": [